{
  "type": "Decision",
  "title": "Use fixtures",
  "status": "stable",
  "generated": { "by": "human:demo", "at": "2026-06-27T09:20:00Z" },
  "bookie": {
    "profile": "1.0",
    "uid": "DSN-01ARZ3NDEKTSV4RRFFQ69G5FAZ",
    "project": "/projects/demo/project.md",
    "state": "accepted",
    "created_at": "2026-06-27T09:20:00Z"
  }
}
