{
  "type": "Document",
  "title": "Demo document",
  "status": "stable",
  "generated": { "by": "human:demo", "at": "2026-06-27T09:10:00Z" },
  "bookie": {
    "profile": "1.0",
    "uid": "DOC-01ARZ3NDEKTSV4RRFFQ69G5FAX",
    "project": "/projects/demo/project.md",
    "created_at": "2026-06-27T09:10:00Z"
  }
}
