{
  "type": "Task",
  "title": "Demo task",
  "status": "draft",
  "generated": { "by": "human:demo", "at": "2026-06-27T09:05:00Z" },
  "bookie": {
    "profile": "1.0",
    "uid": "TSK-01ARZ3NDEKTSV4RRFFQ69G5FAW",
    "project": "/projects/demo/project.md",
    "state": "ready",
    "created_at": "2026-06-27T09:05:00Z"
  }
}
